issue_number,issue_title,issue_reporter,issue_state,issue_created_at,issue_closed_at,pr_id,has_bot_involvement,bot_names,total_commits,ai_commits,human_commits,bot_commits_percentage,total_comments,ai_comments,human_comments,bot_comments_percentage,total_reviews,ai_reviews,human_reviews,bot_reviews_percentage
51415,[Azure Mgmt Generator] The `Create` operation for a resource should always have the `CreateOrUpdate` name,ArcturusZhang,closed,2025-07-23T07:59:25Z,2025-07-24T06:19:29Z,3255507938,True,"copilot-pull-request-reviewer[bot], Copilot, copilot-swe-agent[bot]",9,9,0,100.0,4,2,2,50.0,19,11,8,57.89
7233,GDPR comment incorrect,benibenj,closed,2025-07-07T08:55:46Z,2025-07-08T13:36:09Z,3208124851,True,None,2,2,0,100.0,0,0,0,0.0,5,0,5,0.0
5878,Add analyzer to flow TestContext.CancellationToken in tests,Youssef1313,closed,2025-06-25T07:42:38Z,2025-07-22T14:56:40Z,3208129291,True,Copilot,6,6,0,100.0,2,1,1,50.0,1,0,1,0.0
5785,`AbortWithCTRLPlusC_TestHost_Succeeded` is too flaky,Youssef1313,closed,2025-06-16T13:44:43Z,2025-07-23T02:46:40Z,3208130662,True,Copilot,3,3,0,100.0,3,1,2,33.33,2,0,2,0.0
248910,"Comment threads should render scrollbar underneath the text, not over it",marrej,closed,2025-05-14T08:44:22Z,2025-07-09T09:47:58Z,3208198363,True,Copilot,3,3,0,100.0,2,1,1,50.0,0,0,0,0.0
9247,NzInputOtpComponent does not autocomplete from SMS,ironista,open,2025-06-25T08:57:44Z,,3208317450,True,"codecov[bot], zorro-bot[bot]",3,3,0,100.0,2,2,0,100.0,0,0,0,0.0
9095,nz-tabset memory leak,sylux6,open,2025-04-16T14:21:47Z,,3208320625,True,"Copilot, codecov[bot], zorro-bot[bot]",3,3,0,100.0,4,3,1,75.0,0,0,0,0.0
78,[feat] add APIM IaC bicep setup,manekinekko,open,2025-06-05T21:05:47Z,,3186154990,True,None,2,2,0,100.0,0,0,0,0.0,0,0,0,0.0
209,Crash: SfTextInputLayout throws Java.Lang.IllegalArgumentException on very small container width,netstersk,closed,2025-06-27T16:43:45Z,2025-07-04T09:42:23Z,3186197332,True,"copilot-pull-request-reviewer[bot], Copilot, azure-pipelines[bot]",4,4,0,100.0,11,5,6,45.45,2,1,1,50.0
424,[desktop_drop] Linux snap build fails due to `std::getenv` not available,OutdatedGuy,closed,2025-07-21T04:07:23Z,2025-07-22T03:22:21Z,3219083731,True,None,3,3,0,100.0,0,0,0,0.0,0,0,0,0.0
255124,Panel chat gear dropdown should have hints on hover,ulugbekna,open,2025-07-10T12:13:55Z,,3219114950,True,Copilot,5,5,0,100.0,2,1,1,50.0,0,0,0,0.0
5103,`grpc(s)` protocol URLs to Camunda 8 SaaS are rejected,nikku,closed,2025-06-17T11:57:54Z,2025-08-05T10:52:31Z,3219169922,True,None,3,3,0,100.0,3,0,3,0.0,0,0,0,0.0
2977,[FEATURE] Tool to extract information from rules and docs,BernieWhite,open,2025-07-10T12:36:21Z,,3219203139,True,None,6,5,1,83.33,0,0,0,0.0,0,0,0,0.0
1924,delete the memstats routine,rach-id,closed,2025-06-06T14:22:27Z,2025-06-11T15:53:19Z,3219279897,True,"github-actions[bot], mergify[bot], codecov[bot]",4,2,2,50.0,4,3,1,75.0,3,0,3,0.0
1915,Extracting equations from docx files: KeyError: 'fPr',smortezah,closed,2025-07-09T14:19:06Z,2025-07-11T07:52:17Z,3219282636,True,"github-actions[bot], mergify[bot], codecov[bot]",5,3,2,60.0,3,3,0,100.0,4,0,4,0.0
178,Duplicate users with Github Enterprise and multiple organizations,AnguIar,closed,2025-03-16T10:02:13Z,2025-07-08T03:50:57Z,3219342467,True,Copilot,6,3,3,50.0,2,1,1,50.0,3,0,3,0.0
3996,fix: keyboard navigation not working for FluentNavLink inside a FluentNavGroup,cshisol,closed,2025-07-10T09:10:03Z,2025-07-14T17:10:17Z,3219404295,True,"github-actions[bot], Copilot",10,5,5,50.0,5,4,1,80.0,5,0,5,0.0
1718,Null pointer dereferance may happen due to no null check for the return value of create_ioa_engine.,z472421519,closed,2025-07-10T00:01:24Z,2025-07-11T10:40:29Z,3219406613,True,None,2,2,0,100.0,0,0,0,0.0,0,0,0,0.0
23832,Include warnings against using volatile,The-Futurist,closed,2021-04-18T15:37:35Z,2025-07-15T17:04:58Z,3219478531,True,"Copilot, copilot-swe-agent[bot]",3,3,0,100.0,2,1,1,50.0,4,1,3,25.0
49327,.NET SDK doesn't handle all invalid characters in the root namespace,marcpopMSFT,closed,2025-06-10T20:46:31Z,2025-07-01T20:40:21Z,3134836043,True,"copilot-pull-request-reviewer[bot], Copilot, copilot-swe-agent[bot]",12,10,2,83.33,21,10,11,47.62,13,3,10,23.08
2229,Allow users to report suspicious bug reports.,DonnieBLT,open,2024-06-01T20:05:20Z,,3134892391,True,"Copilot, copilot-swe-agent[bot]",5,5,0,100.0,7,1,6,14.29,9,3,6,33.33
208554,Disable multi selection for notebook outline view,rebornix,open,2024-03-25T05:24:21Z,,3134900878,True,None,2,2,0,100.0,0,0,0,0.0,0,0,0,0.0
209161,Selecting symbol from notebook outline doesn't highlight in editor properly,rebornix,open,2024-03-29T21:46:14Z,,3134901340,True,copilot-swe-agent[bot],3,3,0,100.0,0,0,0,0.0,2,1,1,50.0
210520,getMarkdownHeadersInCell does not handle headers with HTML tags,DonJayamanne,open,2024-04-17T00:41:11Z,,3134901959,True,copilot-swe-agent[bot],5,3,2,60.0,0,0,0,0.0,2,1,1,50.0
3536,SimpleCov test coverage is missing for some files,jonrohan,closed,2025-06-10T20:39:16Z,2025-06-10T22:11:41Z,3134908383,True,"copilot-pull-request-reviewer[bot], changeset-bot[bot]",2,2,0,100.0,1,1,0,100.0,2,1,1,50.0
200290,Raw file contains image data even if it is not shown in the notebook,sandy081,open,2022-09-28T06:48:27Z,,3134913454,True,None,3,3,0,100.0,0,0,0,0.0,0,0,0,0.0
211114,Sticky scroll flashing non stop,jrieken,open,2024-04-23T15:58:35Z,,3134916409,True,Copilot,3,3,0,100.0,2,1,1,50.0,0,0,0,0.0
208672,markdown cell status bar appears to be draggable but is not,Tyriar,closed,2024-03-25T14:50:50Z,2025-06-11T16:37:23Z,3134922059,True,None,2,2,0,100.0,0,0,0,0.0,3,0,3,0.0
130443,Can't drag markdown cells in edit mode,benstreb,open,2021-08-07T18:41:21Z,,3134923757,True,Copilot,5,4,1,80.0,2,2,0,100.0,2,0,2,0.0
3128,[PVC] Consider setting a max-width on breadcrumbs to help with long breadcrumb items,joshblack,closed,2024-10-02T16:05:43Z,2025-06-10T23:56:33Z,3134925346,True,"github-actions[bot], changeset-bot[bot], copilot-pull-request-reviewer[bot]",6,2,4,33.33,2,2,0,100.0,3,1,2,33.33
216172,Down arrow in middle of last line in last notebook cell does not move cursor to end of line,joyceerhl,closed,2024-06-17T21:58:42Z,2025-06-12T22:47:31Z,3134926821,True,"Copilot, copilot-swe-agent[bot]",6,5,1,83.33,2,1,1,50.0,5,1,4,20.0
20999,[REGRESSION]: UsePythonVersion@0 installs partial Python files,mmaitre314,open,2025-04-25T23:05:05Z,,3134927053,True,None,3,3,0,100.0,0,0,0,0.0,0,0,0,0.0
235117,`notebook.addFindMatchToSelection` keeps looping,joaomoreno,closed,2024-12-03T11:11:56Z,2025-06-13T17:29:25Z,3134927763,True,copilot-swe-agent[bot],5,3,2,60.0,0,0,0,0.0,4,1,3,25.0
3541,Fix deprecation warning for rails config,jonrohan,closed,2025-06-10T22:14:09Z,2025-06-10T22:52:36Z,3134961752,True,"copilot-pull-request-reviewer[bot], changeset-bot[bot]",6,4,2,66.67,1,1,0,100.0,1,1,0,100.0
45735,[New Port Request] <cpp-rotor>,ilongshan,open,2025-05-29T03:30:58Z,,3134962245,True,None,5,5,0,100.0,0,0,0,0.0,0,0,0,0.0
50530,[BUG] Documentation is wrong about how to disable telemetry,KrzysztofCwalina,closed,2025-06-10T22:30:00Z,2025-06-10T23:32:56Z,3134983232,True,copilot-swe-agent[bot],3,3,0,100.0,1,0,1,0.0,7,2,5,28.57
10836,Update custom azure pipeline yaml conditions to respect canceled status,benbp,open,2025-06-09T20:43:44Z,,3135029438,True,copilot-pull-request-reviewer[bot],2,2,0,100.0,0,0,0,0.0,2,1,1,50.0
1906,[FR]: Create Python API for CLI command,xiaoyu-work,closed,2025-06-10T23:35:58Z,2025-06-19T01:29:38Z,3135068930,True,"github-advanced-security[bot], Copilot, azure-pipelines[bot]",22,6,16,27.27,17,5,12,29.41,12,3,9,25.0
780,Encoding/Separator Config For CSV Export,benrr101,open,2017-03-15T18:50:36Z,,3135071104,True,github-actions[bot],5,3,2,60.0,2,1,1,50.0,0,0,0,0.0
2231,Extend PredefinedDynamicTraceEventParser to Support Dynamic Events from EventPipeEventSource,brianrob,closed,2025-06-10T23:45:52Z,2025-06-20T17:17:42Z,3135078870,True,"Copilot, copilot-swe-agent[bot]",7,4,3,57.14,6,2,4,33.33,5,2,3,40.0
10,Add support for Firebase Studio,intellectronica,closed,2025-05-21T19:23:50Z,2025-06-07T21:27:22Z,3127513584,True,None,3,3,0,100.0,0,0,0,0.0,1,0,1,0.0
14785,"Since 0.8.0, version_get_fallback_unmanaged_json fails outside of a git checkout",musicinmybrain,closed,2025-07-21T11:05:03Z,2025-07-21T14:17:07Z,3248464116,True,Copilot,3,3,0,100.0,2,1,1,50.0,0,0,0,0.0
11890,Teach Copilot setup about our SDK version,rainersigwald,closed,2025-05-23T17:00:54Z,2025-06-05T14:39:41Z,3086985638,True,"copilot-pull-request-reviewer[bot], Copilot, dotnet-policy-service[bot]",4,3,1,75.0,3,2,1,66.67,3,1,2,33.33
1121,[slang-tidy] OnlyAssignedOnReset triggered incorrectly with structs and for loops,Sustrak,closed,2024-09-13T12:56:34Z,2025-05-24T00:34:56Z,3087031790,True,"copilot-swe-agent[bot], codecov[bot]",3,3,0,100.0,1,1,0,100.0,3,2,1,66.67
1632,IngestionSetup.kql is too large,MSBrett,closed,2025-05-23T17:43:39Z,2025-05-29T08:53:21Z,3087094895,True,copilot-swe-agent[bot],10,5,5,50.0,1,0,1,0.0,11,8,3,72.73
1336,[hub] Export `HUB_URL` so consumers can consume it,julien-c,closed,2025-04-03T16:59:30Z,2025-05-26T07:11:32Z,3087099176,True,Copilot,5,5,0,100.0,8,4,4,50.0,5,0,5,0.0
899,Add user agent with package version for hub calls,coyotte508,open,2024-09-09T08:53:03Z,,3087108042,True,Copilot,2,2,0,100.0,2,1,1,50.0,0,0,0,0.0
1001,Suffix all imports with `.js`,coyotte508,open,2024-10-30T14:30:04Z,,3087114684,True,"Copilot, copilot-swe-agent[bot]",6,6,0,100.0,4,2,2,50.0,10,4,6,40.0
3083,Reopen - Option to include security_repo_status in list_models API for bulk queries,weigary,open,2025-05-14T16:49:41Z,,3087132572,True,Copilot,2,2,0,100.0,7,2,5,28.57,0,0,0,0.0
2963,Update `inference` parameter and add `inference_provider` parameter in `list_models`,Wauplin,closed,2025-03-28T18:02:31Z,2025-06-03T15:39:57Z,3087132571,True,None,2,2,0,100.0,3,0,3,0.0,1,0,1,0.0
3055,"InferenceClient.post is deprecated, but Sentence Ranking tasks are not implemented",marr75,open,2025-05-06T16:58:53Z,,3087132573,True,None,1,1,0,100.0,0,0,0,0.0,0,0,0,0.0
48482,[QUERY][Azure Monitor Exporter] Bucket aggregation for histograms,pblachut,open,2025-02-28T09:21:01Z,,3087281120,True,None,2,2,0,100.0,1,0,1,0.0,0,0,0,0.0
218,"Bug = Certain images are not downloaded, and do not give an error warning",TheThirdComputer,closed,2025-01-26T01:51:15Z,2025-07-31T14:47:08Z,3087338450,True,Copilot,4,4,0,100.0,3,1,2,33.33,0,0,0,0.0
61220,Implement runtime-based `IValidatableTypeInfoResolver` implementation,captainsafia,open,2025-03-28T23:19:53Z,,3087359752,True,Copilot,4,4,0,100.0,4,1,3,25.0,0,0,0,0.0
2160,Add an uninstall Interface to run custom module code,valadas,open,2018-07-16T04:53:33Z,,3087399940,True,None,2,2,0,100.0,6,0,6,0.0,0,0,0,0.0
41167,azure-keyvault-keys needs typing updates for mypy version 1.14.1,azure-sdk,closed,2025-05-17T22:53:35Z,2025-05-24T22:53:49Z,3087406519,True,github-actions[bot],2,2,0,100.0,1,1,0,100.0,0,0,0,0.0
3373,"When exporting to variables, remember the used themes and variable settings in the file",six7,closed,2025-05-23T20:15:16Z,2025-06-25T12:29:43Z,3087442273,True,"github-actions[bot], Copilot, sonarqubecloud[bot], changeset-bot[bot], copilot-swe-agent[bot]",9,7,2,77.78,8,6,2,75.0,18,14,4,77.78
9490,Aspire CLI ctrl+c error message,maddymontaquila,closed,2025-05-23T20:25:05Z,2025-05-29T18:07:42Z,3087459580,True,Copilot,2,2,0,100.0,4,1,3,25.0,1,0,1,0.0
167,[BUG] Binding SelectedDates is not being propagate to the RangeSelectionCalendar control,standamikes,closed,2025-04-25T11:24:38Z,2025-05-30T16:19:21Z,3087462018,True,None,3,2,1,66.67,0,0,0,0.0,0,0,0,0.0
9257,[CI] Handle failure to download Playwright dependencies,radical,open,2025-05-12T18:31:40Z,,3087519869,True,None,3,3,0,100.0,0,0,0,0.0,0,0,0,0.0
46382,Incorrect arch for macOS,spouliot,open,2025-05-23T20:40:53Z,,3087529807,True,None,2,2,0,100.0,1,0,1,0.0,1,0,1,0.0
12097,"Incorrect ""Restore Entry"" Option Shown for Non-Recycle Bin Items in Search Results",olwig,open,2025-05-15T09:27:15Z,,3147678267,True,"copilot-pull-request-reviewer[bot], Copilot, codecov[bot]",4,3,1,75.0,3,2,1,66.67,1,1,0,100.0
9362,Predefined search to find all TOTP entries,soredake,closed,2023-04-25T10:47:25Z,2025-06-19T13:24:02Z,3147680886,True,"copilot-pull-request-reviewer[bot], Copilot, codecov[bot]",4,3,1,75.0,3,2,1,66.67,2,1,1,50.0
5358,Freeze lottie on the last frame when not looping,reactone,closed,2025-06-09T11:49:27Z,2025-06-15T19:28:52Z,3147775860,True,vercel[bot],2,2,0,100.0,1,1,0,100.0,0,0,0,0.0
11494,Vector methods are missing inheritdoc docs,gewarren,closed,2025-06-20T11:57:09Z,2025-08-02T00:17:02Z,3163071696,True,None,1,1,0,100.0,1,0,1,0.0,0,0,0,0.0
5442,@remotion/whisper-web package: getAvailableModels() API,JonnyBurger,closed,2025-06-20T12:06:05Z,2025-06-20T13:02:37Z,3163097309,True,vercel[bot],2,2,0,100.0,1,1,0,100.0,1,0,1,0.0
4205,Reenable or permanently delete NormalizePathBadGlobalroot,rainersigwald,closed,2019-02-28T22:21:54Z,2025-06-30T09:34:21Z,3163105248,True,dotnet-policy-service[bot],3,3,0,100.0,1,1,0,100.0,2,0,2,0.0
11494,Vector methods are missing inheritdoc docs,gewarren,closed,2025-06-20T11:57:09Z,2025-08-02T00:17:02Z,3163174108,True,None,1,1,0,100.0,0,0,0,0.0,0,0,0,0.0
958,Feedback: Variable frontmatter leads to error,davidsneighbour,open,2025-06-17T22:07:33Z,,3163186785,True,None,3,3,0,100.0,0,0,0,0.0,0,0,0,0.0
5444,`@remotion/google-fonts`: make `loadFont()` method cancellable,samohovets,closed,2025-06-20T12:20:05Z,2025-06-20T17:00:22Z,3163189958,True,vercel[bot],2,2,0,100.0,1,1,0,100.0,0,0,0,0.0
169,[Feature] Focus on editor after using the executeTerminalCommand action,estruyf,closed,2025-06-20T12:43:14Z,2025-07-07T13:37:24Z,3163205877,True,sonarqubecloud[bot],2,2,0,100.0,1,1,0,100.0,0,0,0,0.0
4597,Deployment Pipelines File Due to Keyvault Network Policies,marrobi,closed,2025-06-20T12:55:09Z,2025-06-25T09:50:51Z,3163243779,True,Copilot,4,4,0,100.0,8,1,7,12.5,0,0,0,0.0
7034,Expect option to `Open issue` in editor after creating new issue,bamurtaugh,closed,2025-06-18T17:32:22Z,2025-06-25T17:16:31Z,3163386327,True,Copilot,5,4,1,80.0,2,1,1,50.0,5,0,5,0.0
4732,my anti-anti-adblock filter list,adblockenjoyer,closed,2025-03-02T17:22:25Z,2025-07-29T02:01:28Z,3271675222,True,None,2,2,0,100.0,0,0,0,0.0,0,0,0,0.0
3711,PublicIPPrefix: Allow exporting IP range as ConfigMap,felfa01,closed,2024-01-16T08:06:39Z,2025-07-31T17:05:37Z,3271677684,True,"Copilot, copilot-swe-agent[bot]",7,7,0,100.0,11,5,6,45.45,12,4,8,33.33
4568,Dead dnswarden Adblocking (Domains and Hosts) URL,nilagangmanok,closed,2024-09-29T03:18:51Z,2025-07-29T02:23:30Z,3271698712,True,Copilot,3,3,0,100.0,2,1,1,50.0,0,0,0,0.0
4444,Dead AdblockID URL,NextGenOP,closed,2024-07-27T13:49:21Z,2025-07-29T02:32:00Z,3271730595,True,None,2,2,0,100.0,0,0,0,0.0,0,0,0,0.0
4442,update hufilter URLs,collinbarrett,closed,2024-07-25T12:14:39Z,2025-07-29T02:55:01Z,3271747658,True,Copilot,4,4,0,100.0,2,1,1,50.0,0,0,0,0.0
1054,Update Sample Apps package.json to 0.79.2,anupriya13,open,2025-07-24T06:16:44Z,,3258668926,True,None,1,1,0,100.0,0,0,0,0.0,0,0,0,0.0
1054,Update Sample Apps package.json to 0.79.2,anupriya13,open,2025-07-24T06:16:44Z,,3258683661,True,copilot-pull-request-reviewer[bot],2,2,0,100.0,1,0,1,0.0,1,1,0,100.0
59,Replace Azure Inference URL with GitHub Models API URL,pamelafox,closed,2025-07-24T06:27:05Z,2025-07-24T17:08:20Z,3258691697,True,None,2,2,0,100.0,0,0,0,0.0,0,0,0,0.0
235,Replace Azure Inference URL with GitHub Models API URL,pamelafox,closed,2025-07-24T06:28:25Z,2025-07-24T17:11:27Z,3258694358,True,Copilot,4,4,0,100.0,4,2,2,50.0,0,0,0,0.0
1339,Pass crossorigin attribute value to the internal <img> element for <x-image>,PupilTong,closed,2025-07-24T06:27:27Z,2025-07-24T09:52:36Z,3258699253,True,"coderabbitai[bot], Copilot, codecov[bot], relativeci[bot], changeset-bot[bot], codspeed-hq[bot]",5,4,1,80.0,12,9,3,75.0,2,0,2,0.0
6203,merge Windows XP support PRs #6176 and #6177 into a single contribution,nihui,closed,2025-07-24T06:32:27Z,2025-07-24T07:45:03Z,3258702664,True,"github-actions[bot], codecov-commenter, copilot-pull-request-reviewer[bot]",2,2,0,100.0,3,2,1,66.67,2,1,1,50.0
627,Upgrade Paper Old Arch Gallery app to 0.79.2,anupriya13,closed,2025-07-24T06:39:26Z,2025-07-28T08:55:42Z,3258717917,True,"Copilot, azure-pipelines[bot]",3,3,0,100.0,10,3,7,30.0,3,0,3,0.0
629,Upgrade Fabric New Arch Gallery app to 0.79.2,anupriya13,closed,2025-07-24T06:40:56Z,2025-07-28T08:55:57Z,3258721136,True,"Copilot, azure-pipelines[bot]",4,4,0,100.0,9,4,5,44.44,3,0,3,0.0
5434,依赖存在安全漏洞,idiotzzz,closed,2025-07-22T07:54:29Z,2025-07-25T02:52:40Z,3258721117,True,"github-actions[bot], coderabbitai[bot], Copilot",2,2,0,100.0,7,3,4,42.86,4,0,4,0.0
116,有意增加namesilo的API吗?,LANPAST,closed,2019-11-27T09:37:40Z,2025-07-13T06:10:56Z,3089549989,True,sonarqubecloud[bot],1,1,0,100.0,1,1,0,100.0,0,0,0,0.0
116,有意增加namesilo的API吗?,LANPAST,closed,2019-11-27T09:37:40Z,2025-07-13T06:10:56Z,3089553921,True,sonarqubecloud[bot],2,2,0,100.0,1,1,0,100.0,0,0,0,0.0
574,Add shortcuts in README,vpozdnyakov,closed,2025-05-25T18:53:43Z,2025-07-01T15:09:32Z,3089724053,True,None,2,2,0,100.0,0,0,0,0.0,3,0,3,0.0
9504,Change `.dotnet/aspire` to `.aspire`,mitchdenny,closed,2025-05-26T01:27:33Z,2025-05-26T09:09:30Z,3089749999,True,"Copilot, copilot-swe-agent[bot]",4,4,0,100.0,1,1,0,100.0,5,2,3,40.0
1123,Implement GitHub Page to edit mods from Mod Catalog,Albeoris,closed,2025-06-07T13:29:11Z,2025-06-09T09:41:19Z,3127062679,True,None,1,1,0,100.0,0,0,0,0.0,0,0,0,0.0
1123,Implement GitHub Page to edit mods from Mod Catalog,Albeoris,closed,2025-06-07T13:29:11Z,2025-06-09T09:41:19Z,3127066208,True,None,1,1,0,100.0,0,0,0,0.0,0,0,0,0.0
3013,LayoutTree render count test,raineorshine,open,2025-06-07T15:38:13Z,,3127181957,True,Copilot,4,4,0,100.0,4,2,2,50.0,0,0,0,0.0
344,Add Multi-Language Support for Practice Tests,FidelusAleksander,closed,2025-05-29T18:30:53Z,2025-07-28T08:15:37Z,3127210211,True,Copilot,2,2,0,100.0,1,1,0,100.0,1,0,1,0.0
5451,"MTP's --timeout parsing uses current culture, it should use invariant",Youssef1313,closed,2025-04-11T07:18:23Z,2025-06-10T15:10:28Z,3127222871,True,"codecov-commenter, Copilot, copilot-swe-agent[bot]",9,7,2,77.78,6,6,0,100.0,30,13,17,43.33
5707,"TestMethodAttribute.Execute is overridable, but ExecuteAsync is not",RobSwDev,closed,2025-06-07T17:54:53Z,2025-06-10T07:51:42Z,3127353854,True,github-actions[bot],2,2,0,100.0,2,1,1,50.0,3,0,3,0.0
9603,Only expose endpoint port in docker compose if external is set to true,davidfowl,closed,2025-05-31T03:09:36Z,2025-06-02T01:45:59Z,3238929100,True,copilot-swe-agent[bot],4,4,0,100.0,0,0,0,0.0,5,4,1,80.0
1019,Support --quickPlayMultiplayer option for the instance with server,ci010,closed,2025-07-17T10:03:09Z,2025-07-17T17:34:18Z,3238950653,True,"Copilot, copilot-swe-agent[bot]",7,7,0,100.0,1,1,0,100.0,12,6,6,50.0
1000,Feature Request: Xaero's Minimap & World Map Integration,Gesugao-san,open,2025-06-12T17:40:02Z,,3238958692,True,None,3,3,0,100.0,3,0,3,0.0,0,0,0,0.0
4248,`custom_domain` and `tre_url` settings are confusing,tamirkamara,open,2025-01-05T14:16:26Z,,3238991224,True,"github-actions[bot], Copilot, copilot-swe-agent[bot]",7,7,0,100.0,11,6,5,54.55,6,4,2,66.67
4563,"""App Setting Visibility"" toggle icon does not reflect current value state",v-ruizh,open,2025-06-20T03:32:36Z,,3196793854,True,copilot-swe-agent[bot],4,4,0,100.0,1,0,1,0.0,2,1,1,50.0
40358,More hotkeys to interact with search results in Command Palette,akamienski,closed,2025-07-02T18:00:46Z,2025-07-10T02:45:29Z,3196812180,True,"github-actions[bot], Copilot, azure-pipelines[bot]",4,4,0,100.0,8,3,5,37.5,6,0,6,0.0
388,Add a option during the install script to have AI Shell open persistently by adding to the $PROFILE of the user,StevenBucher98,open,2025-06-19T22:13:41Z,,3196844594,True,None,2,2,0,100.0,0,0,0,0.0,5,0,5,0.0
275,[Auto] AI Gallery Standard Validation,ai-apps-bot,closed,2025-06-11T05:01:05Z,2025-07-04T05:49:37Z,3196863235,True,"Copilot, copilot-swe-agent[bot]",5,5,0,100.0,3,2,1,66.67,8,4,4,50.0
4286,Fix this issue,DonnieBLT,open,2025-05-20T04:41:16Z,,3196952174,True,"copilot-pull-request-reviewer[bot], Copilot, copilot-swe-agent[bot]",11,6,5,54.55,5,3,2,60.0,11,6,5,54.55
4249,Update dev docs - cmake dependency,Yury-Fridlyand,closed,2025-06-25T03:21:44Z,2025-07-03T10:48:53Z,3196953655,True,copilot-pull-request-reviewer[bot],4,2,2,50.0,0,0,0,0.0,3,1,2,33.33
4193,[Flaky Test] test_update_connection_password.py,BoazBD,closed,2025-06-15T10:14:10Z,2025-07-06T12:40:29Z,3196955536,True,"copilot-pull-request-reviewer[bot], Copilot",15,6,9,40.0,10,5,5,50.0,3,1,2,33.33
4191,[Flaky Test] test_cluster_scan_non_covered_slots,BoazBD,closed,2025-06-15T09:43:38Z,2025-07-03T08:14:26Z,3196955896,True,copilot-pull-request-reviewer[bot],2,2,0,100.0,0,0,0,0.0,2,1,1,50.0
6420,There are two black backgrounds in the “Move mode” section of the Keyboard Controls in High Contrast mode,Nina-1210,closed,2025-07-01T07:10:11Z,2025-07-02T23:18:26Z,3196995563,True,None,1,1,0,100.0,1,0,1,0.0,0,0,0,0.0
28736,Further remove dependency of Compatibility.Layout on all modern .NET MAUI controls,PureWeen,closed,2025-04-01T19:27:07Z,2025-07-30T16:35:36Z,3196997401,True,Copilot,5,5,0,100.0,4,2,2,50.0,0,0,0,0.0
2594,[BUG] TrackPageView does not reset maxAjaxCallsPerView,damian-przygodzki,closed,2025-06-30T12:18:51Z,2025-07-28T16:27:58Z,3197014348,True,"copilot-pull-request-reviewer[bot], Copilot, copilot-swe-agent[bot]",20,20,0,100.0,10,5,5,50.0,30,16,14,53.33
855,Remove GitHub Action Usage of Windows Server 2019 #5138,mtfriesen,closed,2025-06-03T17:20:56Z,2025-06-03T19:11:40Z,3197019965,True,copilot-pull-request-reviewer[bot],5,3,2,60.0,0,0,0,0.0,1,1,0,100.0
9964,Add ASP.NET Core release notes for .NET 10 Preview 6,danroth27,open,2025-07-02T19:54:45Z,,3197023120,True,"Copilot, copilot-swe-agent[bot]",30,8,22,26.67,7,2,5,28.57,30,7,23,23.33
12183,"Add keyboard shortcut to ""Jump to Group"" from search results",etosan,open,2025-06-12T06:10:20Z,,3171708235,True,"copilot-pull-request-reviewer[bot], codecov[bot]",3,2,1,66.67,1,1,0,100.0,2,1,1,50.0
10241,Find unused MSBuild properties,jonathanpeppers,closed,2025-06-24T13:44:01Z,2025-06-27T18:53:55Z,3172070799,True,"Copilot, copilot-swe-agent[bot]",6,5,1,83.33,4,2,2,50.0,6,3,3,50.0
91,[docs] update current documentation,manekinekko,closed,2025-06-24T14:39:46Z,2025-06-25T07:32:10Z,3172267745,True,None,4,4,0,100.0,0,0,0,0.0,0,0,0,0.0
615,"M04-LAB10: Instructions tell to use a ""previously created Service Principal"" never created in the lab",massimobonanni,closed,2024-11-14T11:48:36Z,2025-06-27T21:03:31Z,3172352593,True,None,2,2,0,100.0,0,0,0,0.0,2,0,2,0.0
1265,Upgrade System.CommandLine,waldekmastykarz,closed,2025-06-23T19:08:42Z,2025-07-02T12:53:21Z,3172362186,True,Copilot,10,9,1,90.0,2,2,0,100.0,2,0,2,0.0
6689,Blazor Hybrid iOS Disable Elastic Scrolling,TanayParikh,closed,2022-04-29T22:47:11Z,2025-08-01T22:06:36Z,3172381881,True,"Copilot, azure-pipelines[bot]",5,5,0,100.0,3,2,1,66.67,1,0,1,0.0
2060,remove CAT mempool panic for duplicate peers in main,rach-id,closed,2025-06-24T15:20:10Z,2025-06-30T15:44:32Z,3172409641,True,"Copilot, copilot-swe-agent[bot]",6,4,2,66.67,1,1,0,100.0,12,2,10,16.67
2061,add mergify rule to backport to main,rach-id,closed,2025-06-24T15:21:09Z,2025-06-26T09:11:24Z,3172410605,True,None,3,2,1,66.67,0,0,0,0.0,4,0,4,0.0
3883,"Make appending the message ID to test case names configurable - only include it when combinators are used; otherwise, use the base test case name.",bhagyapathak,closed,2025-06-24T10:35:43Z,2025-06-26T03:55:48Z,3172444753,True,Copilot,4,4,0,100.0,10,4,6,40.0,2,0,2,0.0
50825,Resolve AOT warnings for builder extensions,m-redding,closed,2025-06-24T15:45:32Z,2025-06-25T20:09:41Z,3172482561,True,"Copilot, copilot-swe-agent[bot]",6,6,0,100.0,5,2,3,40.0,7,3,4,42.86
329,Integrate @sapientpants/sonarqube-mcp-server and address critical code quality findings,LaurentLesle,closed,2025-06-24T16:14:24Z,2025-06-24T16:43:17Z,3172566371,True,sonarqubecloud[bot],3,3,0,100.0,2,1,1,50.0,0,0,0,0.0
4475,Cleanup: EBPF_NANO_SECONDS_PER_FILETIME_TICK duplicates EBPF_NS_PER_FILETIME,dthaler,open,2025-06-24T16:16:48Z,,3172572289,True,Copilot,2,2,0,100.0,3,1,2,33.33,4,0,4,0.0
3869,Airframe surface: crash with a type inherited from a trait,OndrejSpanel,closed,2025-03-06T08:46:51Z,2025-05-31T06:26:16Z,3104609654,True,None,3,3,0,100.0,0,0,0,0.0,0,0,0,0.0
3813,Surface.of[Int] after Surface.of[1] returns Surface.of[Object],ikeyan,closed,2025-02-06T12:42:12Z,2025-05-31T08:02:23Z,3104613438,True,None,2,2,0,100.0,0,0,0,0.0,0,0,0,0.0
3097,http: Fix flaky tests using httpbin.org,xerial,closed,2023-08-04T17:02:30Z,2025-06-02T19:27:16Z,3104617640,True,None,2,2,0,100.0,0,0,0,0.0,0,0,0,0.0
3453,airframe-rx-html: onMount may not be able to find the rendered DOM element,xerial,closed,2024-03-15T21:04:01Z,2025-06-02T18:51:16Z,3104618566,True,None,2,2,0,100.0,0,0,0,0.0,0,0,0,0.0
3871,feature: Add Rx.delay(..) operation to insert artificial delay,xerial,closed,2025-03-08T00:55:38Z,2025-06-02T17:22:51Z,3104619100,True,None,2,2,0,100.0,0,0,0,0.0,0,0,0,0.0
3038,aispec: Show the context code around shouldBe matchers ,xerial,open,2023-06-25T21:13:36Z,,3104620306,True,None,2,2,0,100.0,0,0,0,0.0,0,0,0,0.0
2169,Legends in charts do not support font settings,jebirch,closed,2025-07-07T16:11:52Z,2025-07-10T00:15:09Z,3104621101,True,None,2,2,0,100.0,1,0,1,0.0,0,0,0,0.0
1027,[BUG] Can't compile package with Scorm2004API selected,PaulSchult,closed,2025-06-16T08:25:03Z,2025-07-16T02:11:48Z,3104622698,True,None,1,1,0,100.0,0,0,0,0.0,0,0,0,0.0
396,Text color issue on Edge mobile,gkulin,closed,2024-05-21T04:13:01Z,2025-07-10T02:26:36Z,3104623370,True,None,2,2,0,100.0,0,0,0,0.0,0,0,0,0.0
9603,Only expose endpoint port in docker compose if external is set to true,davidfowl,closed,2025-05-31T03:09:36Z,2025-06-02T01:45:59Z,3104789631,True,"copilot-pull-request-reviewer[bot], Copilot, copilot-swe-agent[bot]",5,3,2,60.0,6,2,4,33.33,6,2,4,33.33
