issue_number,issue_title,issue_reporter,issue_state,issue_created_at,issue_closed_at,pr_id,has_bot_involvement,bot_names,total_commits,ai_commits,human_commits,bot_commits_percentage,total_comments,ai_comments,human_comments,bot_comments_percentage,total_reviews,ai_reviews,human_reviews,bot_reviews_percentage
3294,Update generated package `engines` field to node 20,maorleger,closed,2025-06-16T17:13:54Z,2025-06-19T07:42:05Z,3150709470,True,Copilot,9,4,5,44.44,2,1,1,50.0,1,0,1,0.0
10207,Remove `Xamarin.Android.Tasks.MakeBundleNativeCodeExternal`,jonathanpeppers,closed,2025-06-16T17:35:43Z,2025-06-16T23:46:57Z,3150761777,True,Copilot,6,3,3,50.0,3,1,2,33.33,2,0,2,0.0
32611,Clarify AzureCLICredential invalid Subscription error,chlowell,closed,2025-01-18T00:08:49Z,2025-06-16T21:31:39Z,3150768290,True,None,2,2,0,100.0,0,0,0,0.0,0,0,0,0.0
5288,Error handling build-args mapped to parameters with hyphens,vhvb1989,closed,2025-06-16T17:42:51Z,2025-06-24T03:10:43Z,3150780897,True,copilot-swe-agent[bot],3,3,0,100.0,0,0,0,0.0,2,1,1,50.0
35010,"Microsoft.Data.Sqlite keeps handle on file even after close, and pool clear",ericnev,closed,2024-10-29T14:25:02Z,2025-06-06T06:38:04Z,3109908968,True,"Copilot, copilot-swe-agent[bot]",5,5,0,100.0,2,1,1,50.0,9,6,3,66.67
1291,Pyslang Example: Extract the names of all `logic`s,parker-research,closed,2025-03-31T15:03:47Z,2025-06-09T16:49:22Z,3109986701,True,None,1,1,0,100.0,0,0,0,0.0,0,0,0,0.0
7,Add links to devin's search queries in README,aavetis,closed,2025-06-02T12:33:17Z,2025-06-02T12:47:16Z,3109997644,True,Copilot,4,4,0,100.0,2,1,1,50.0,0,0,0,0.0
29699,java.lang.IllegalArgumentException: You cannot start a load for a destroyed activity - glide,LeoJHarris,open,2025-05-27T22:41:22Z,,3110009700,True,"Copilot, azure-pipelines[bot], copilot-swe-agent[bot]",12,12,0,100.0,30,15,15,50.0,26,15,11,57.69
16017,Fix Violation.json to use correct attributes in linter.py,harupy,closed,2025-06-02T13:32:48Z,2025-06-17T00:48:19Z,3110219932,True,"github-actions[bot], copilot-pull-request-reviewer[bot]",2,2,0,100.0,2,1,1,50.0,1,1,0,100.0
265,Test,jeffkl,closed,2025-06-11T23:03:16Z,2025-06-11T23:12:33Z,3110337533,True,"codecov-commenter, Copilot",3,3,0,100.0,3,2,1,66.67,2,0,2,0.0
249601,code --wait --merge never exits,anguslees,closed,2025-05-23T08:13:53Z,2025-06-02T19:15:35Z,3110366053,True,None,3,3,0,100.0,1,0,1,0.0,0,0,0,0.0
585,国投证券,lemahuan,open,2025-06-05T16:10:20Z,,3110526097,True,None,3,2,1,66.67,2,0,2,0.0,0,0,0,0.0
8752,Simplify AzureProvisioner and make it testable,davidfowl,closed,2025-04-13T06:52:24Z,2025-06-11T03:23:46Z,3124026492,True,"Copilot, copilot-swe-agent[bot]",30,22,8,73.33,22,11,11,50.0,30,12,18,40.0
184,Improve biome update flow,haydenbleasel,closed,2025-06-27T06:56:03Z,2025-06-27T07:31:29Z,3124143626,True,"Copilot, copilot-swe-agent[bot]",7,7,0,100.0,2,2,0,100.0,15,7,8,46.67
1913,Add mergify rule to backport from main to v0.38.x-celestia,rach-id,closed,2025-06-06T09:47:04Z,2025-06-10T18:20:30Z,3124252797,True,None,6,2,4,33.33,1,0,1,0.0,7,0,7,0.0
518,[Feature] 腾讯云 EdgeOne 国际版,eallion,closed,2025-07-13T04:51:11Z,2025-07-13T13:42:34Z,3124314563,True,Copilot,5,5,0,100.0,5,2,3,40.0,1,0,1,0.0
13,[feat] implement tool web-search,manekinekko,open,2025-03-21T09:01:00Z,,3124355237,True,microsoft-github-policy-service[bot],4,4,0,100.0,1,1,0,100.0,0,0,0,0.0
16121,[docs] Unused Markdown directive :::tips in docs/prompts/run-and-model.mdx causes Docusaurus warning,harupy,closed,2025-06-06T11:25:36Z,2025-06-09T02:17:22Z,3124498441,True,"github-actions[bot], copilot-pull-request-reviewer[bot]",2,2,0,100.0,3,3,0,100.0,1,1,0,100.0
33,No fetching is made,digzom,open,2023-11-06T08:13:59Z,,3268346615,True,None,2,2,0,100.0,0,0,0,0.0,0,0,0,0.0
34,Format Number (formatar números),profbaco,open,2025-07-17T22:19:35Z,,3268405610,True,None,3,3,0,100.0,0,0,0,0.0,0,0,0,0.0
36236,[python][compute] update readme.python.md to convert to singleapi package,msyyc,closed,2025-07-28T07:07:51Z,2025-07-28T07:10:00Z,3268453170,True,openapi-pipeline-app[bot],1,1,0,100.0,2,2,0,100.0,0,0,0,0.0
81,请求日志增加删除功能,xuzeyu91,closed,2025-07-28T07:00:12Z,2025-07-28T08:34:31Z,3268489240,True,"copilot-pull-request-reviewer[bot], Copilot",3,3,0,100.0,2,1,1,50.0,1,1,0,100.0
125,Table formatting issues under Reusable Prompt heading,codemillmatt,closed,2025-07-25T02:31:20Z,2025-07-25T02:42:43Z,3261779776,True,copilot-pull-request-reviewer[bot],2,2,0,100.0,0,0,0,0.0,2,1,1,50.0
4847,`Invalid memory address or nil pointer dereference\ncaused by transaction:\n*types.MsgPayForBlobs`,pippokr,closed,2025-05-20T15:00:42Z,2025-06-09T18:22:48Z,3261852303,True,copilot-swe-agent[bot],4,4,0,100.0,1,0,1,0.0,6,4,2,66.67
865,使用组件库qrcode组件替换qrcode.vue包,liweijie0812,closed,2025-07-17T14:57:54Z,2025-07-25T12:49:10Z,3261857525,True,"github-actions[bot], copilot-swe-agent[bot]",3,3,0,100.0,1,1,0,100.0,4,1,3,25.0
446,Invocable With PreventOverlap,jamesmh,open,2025-07-20T03:10:17Z,,3261871194,True,"github-actions[bot], Copilot",2,0,2,0.0,6,3,3,50.0,1,0,1,0.0
642,"TextArea should have TextInputOptions.ReturnKeyType=""Return"" by default",rabbitism,closed,2025-07-25T03:40:10Z,2025-07-25T05:46:52Z,3261881244,True,None,2,2,0,100.0,1,0,1,0.0,1,0,1,0.0
65,[chore] Migration UI to Angular v20,manekinekko,closed,2025-05-30T07:49:31Z,2025-07-23T11:10:02Z,3190739105,True,None,2,2,0,100.0,0,0,0,0.0,1,0,1,0.0
562,Support Lua5.5,CppCXY,closed,2025-07-01T06:51:35Z,2025-07-17T06:25:29Z,3190992971,True,None,1,1,0,100.0,0,0,0,0.0,0,0,0,0.0
1846,"""Deploy to Azure"" button fails with two deployments",PromptifyAdmin,closed,2025-06-30T14:47:45Z,2025-07-04T13:47:34Z,3191173020,True,None,2,2,0,100.0,0,0,0,0.0,0,0,0,0.0
1345,Null-able fields for probe geometry,samuelbray32,closed,2025-07-08T16:52:30Z,2025-07-21T16:37:40Z,3216289477,True,"copilot-swe-agent[bot], codecov[bot]",7,4,3,57.14,1,1,0,100.0,5,2,3,40.0
377,Support `deliveredto` rule,legeana,open,2023-12-19T17:30:53Z,,3216405361,True,codecov[bot],2,2,0,100.0,1,1,0,100.0,0,0,0,0.0
2891,Add test cases for BPF_MAP_TYPE_HASH_OF_MAPS and BPF_MAP_TYPE_ARRAY _OF_MAPS,shpalani,open,2023-09-23T01:45:10Z,,3216407461,True,"Copilot, copilot-swe-agent[bot]",7,7,0,100.0,8,4,4,50.0,4,2,2,50.0
254,Noip (DNS provider),zirotee,closed,2021-04-13T15:40:27Z,2025-07-04T18:00:45Z,3216426710,True,None,4,4,0,100.0,1,0,1,0.0,1,0,1,0.0
62027,JSDoc `@import` causes `getCompletionEntryDetails` to crash,louwers,open,2025-07-09T11:43:35Z,,3216466129,True,None,2,2,0,100.0,2,0,2,0.0,1,0,1,0.0
5460,Update gh cli version to version 2.75.0,vhvb1989,closed,2025-07-09T16:28:06Z,2025-07-15T17:40:30Z,3216510215,True,"Copilot, azure-pipelines[bot]",3,3,0,100.0,8,3,5,37.5,6,0,6,0.0
35145,"[identity-broker] should we remove ""browser"" tshy dialect from package.json",jeremymeng,closed,2025-07-08T18:05:18Z,2025-07-14T22:20:35Z,3216511780,True,copilot-swe-agent[bot],3,3,0,100.0,1,0,1,0.0,8,1,7,12.5
1273,Improve Dev Proxy API port conflict handling,garrytrinder,open,2025-06-25T11:16:48Z,,3175254454,True,None,3,3,0,100.0,0,0,0,0.0,0,0,0,0.0
8538,IServiceScope should get disposed when the associated window is destroyed or closed,PureWeen,open,2022-07-05T16:51:58Z,,3175381820,True,azure-pipelines[bot],3,3,0,100.0,2,1,1,50.0,0,0,0,0.0
46938,Left outer join method syntax throws a null reference exception - join operators documentation,valentincpopa,closed,2025-06-24T22:23:28Z,2025-06-25T12:57:19Z,3175532422,True,None,1,1,0,100.0,0,0,0,0.0,0,0,0,0.0
252367,Terminal Integrated Suggest doesn't work with Nushell,saikatdas0790,closed,2025-06-25T04:43:47Z,2025-07-03T15:59:19Z,3175535650,True,"Copilot, copilot-swe-agent[bot]",11,6,5,54.55,6,3,3,50.0,7,1,6,14.29
649,Sitemap for Large sites with filter date/year,advwebin,open,2023-10-29T19:11:28Z,,3175558732,True,None,5,5,0,100.0,0,0,0,0.0,0,0,0,0.0
185,wrap `data` to support datatype names with no parentheses,gelisam,open,2022-12-17T22:12:32Z,,3175574755,True,None,2,2,0,100.0,0,0,0,0.0,0,0,0,0.0
178,Duplicate users with Github Enterprise and multiple organizations,AnguIar,closed,2025-03-16T10:02:13Z,2025-07-08T03:50:57Z,3175607758,True,Copilot,3,3,0,100.0,1,1,0,100.0,1,0,1,0.0
7081,Open Changes button on issues,alexr00,closed,2025-06-25T13:34:37Z,2025-06-25T17:10:54Z,3175679559,True,None,2,2,0,100.0,0,0,0,0.0,3,0,3,0.0
397,Fix documentation and typos,srinathsetty,closed,2025-06-25T14:18:49Z,2025-06-30T23:54:32Z,3175849392,True,Copilot,4,4,0,100.0,2,1,1,50.0,1,0,1,0.0
3188,Multi-cloud support for MPG,MaryGao,closed,2025-05-08T09:01:57Z,2025-07-16T05:08:55Z,3089909118,True,copilot-swe-agent[bot],6,5,1,83.33,1,0,1,0.0,6,3,3,50.0
19,Update close_caption_extraction to adapt to updated UI,CakeCrusher,open,2025-05-23T21:17:35Z,,3090002746,True,None,3,3,0,100.0,0,0,0,0.0,0,0,0,0.0
15876,Fix typo in test function name: test_differenet_requirements_create_different_environments,harupy,closed,2025-05-26T05:10:24Z,2025-05-26T05:27:52Z,3090023166,True,"github-actions[bot], copilot-pull-request-reviewer[bot]",2,2,0,100.0,2,1,1,50.0,1,1,0,100.0
15878,Update astral-sh/setup-uv step in .github/actions/setup-python/action.yml,harupy,closed,2025-05-26T05:20:39Z,2025-05-26T06:27:40Z,3090037689,True,"github-actions[bot], copilot-swe-agent[bot]",3,3,0,100.0,2,1,1,50.0,2,1,1,50.0
24688,[bug] changelog generated by sdk automation shows wrong breaking change num,tadelesh,closed,2025-05-26T06:05:42Z,2025-06-10T01:54:44Z,3090110097,True,None,3,3,0,100.0,0,0,0,0.0,0,0,0,0.0
15880,Migrate pytest.ini configuration to pyproject.toml,harupy,closed,2025-05-26T06:35:38Z,2025-05-26T08:18:04Z,3090183341,True,"github-actions[bot], copilot-swe-agent[bot], Copilot, copilot-pull-request-reviewer[bot]",2,2,0,100.0,4,2,2,50.0,3,2,1,66.67
11,Make the chart less busy now that we have lots of Agents to track,aavetis,closed,2025-06-04T17:32:04Z,2025-06-04T19:09:58Z,3259381415,True,None,2,2,0,100.0,0,0,0,0.0,0,0,0,0.0
4470,Gradle build fails due to Maven Central rate limiting (HTTP 429),GilboaAWS,closed,2025-07-24T10:28:31Z,2025-07-24T12:17:20Z,3259387186,True,None,2,2,0,100.0,0,0,0,0.0,2,0,2,0.0
222388,Graph - Update labels appearance,kfirpeled,open,2025-06-03T15:49:56Z,,3259400363,True,cla-checker-service[bot],3,3,0,100.0,3,1,2,33.33,0,0,0,0.0
617,Allow Resource Group Option to be reused in child commands.,jongio,open,2025-07-16T01:06:43Z,,3211119439,True,"github-actions[bot], Copilot, copilot-pull-request-reviewer[bot]",6,5,1,83.33,7,4,3,57.14,5,2,3,40.0
59,Replace Azure Inference URL with GitHub Models API URL,pamelafox,closed,2025-07-24T06:27:05Z,2025-07-24T17:08:20Z,3211256178,True,"Copilot, codecov[bot]",3,3,0,100.0,3,2,1,66.67,1,0,1,0.0
10066,Add `ProgressReporter` property `DeployingContext`,captainsafia,closed,2025-06-26T15:07:27Z,2025-06-26T17:12:16Z,3179451686,True,copilot-pull-request-reviewer[bot],2,2,0,100.0,0,0,0,0.0,4,1,3,25.0
77,Validating links?,emiltin,open,2021-09-06T07:59:40Z,,3179460425,True,"Copilot, copilot-swe-agent[bot]",7,7,0,100.0,6,2,4,33.33,6,3,3,50.0
2072,Get rid of the PR template,evan-forbes,closed,2025-06-26T15:11:03Z,2025-06-27T15:57:05Z,3179462117,True,copilot-swe-agent[bot],5,3,2,60.0,0,0,0,0.0,5,1,4,20.0
35502,Release planner test,praveenkuttappan,open,2025-06-26T15:13:03Z,,3179467888,True,"Copilot, openapi-pipeline-app[bot], copilot-swe-agent[bot]",18,5,13,27.78,30,14,16,46.67,7,2,5,28.57
7502,[http-client-python] emitter requires pip as a dependency?,l0lawrence,closed,2025-05-29T16:35:03Z,2025-07-01T08:32:29Z,3179515957,True,"github-actions[bot], Copilot, copilot-swe-agent[bot]",21,14,7,66.67,10,5,5,50.0,30,16,14,53.33
2134,CI: fix link,jcstein,closed,2025-07-08T15:32:09Z,2025-07-08T15:40:25Z,3179536433,True,sonarqubecloud[bot],1,1,0,100.0,1,1,0,100.0,0,0,0,0.0
1294,OpenAPI doc for Essentials CWS API,andrew-welker,open,2025-07-24T01:04:45Z,,3179634710,True,None,3,3,0,100.0,2,0,2,0.0,0,0,0,0.0
280,Memory leak,odevelioglu,closed,2025-06-21T22:26:06Z,2025-06-22T20:19:58Z,3179693089,True,None,3,3,0,100.0,0,0,0,0.0,1,0,1,0.0
249426,"Accessibility: Screen Reader Fails to Announce Notification Status  ""4.1.3 Status Messages"" Violation",anitakumari28,closed,2025-05-21T07:32:35Z,2025-06-09T20:01:28Z,3125104127,True,Copilot,12,8,4,66.67,9,4,5,44.44,5,0,5,0.0
29416,Tooltip Delay and Tooltip Duration Settings,BillyMartin1964,open,2025-05-09T10:22:19Z,,3125168618,True,"Copilot, azure-pipelines[bot]",8,7,1,87.5,9,5,4,55.56,2,0,2,0.0
4932,v4.0.2-mocha: grpc call doesn't use RPC define in config,Galadrin,closed,2025-06-05T18:04:16Z,2025-08-01T15:22:16Z,3125187340,True,Copilot,10,6,4,60.0,3,2,1,66.67,1,0,1,0.0
4847,`Invalid memory address or nil pointer dereference\ncaused by transaction:\n*types.MsgPayForBlobs`,pippokr,closed,2025-05-20T15:00:42Z,2025-06-09T18:22:48Z,3125187928,True,None,3,3,0,100.0,0,0,0,0.0,0,0,0,0.0
2242,o8build missing validation for pack includes,brine,closed,2025-06-06T00:48:14Z,2025-06-07T13:14:10Z,3125308183,True,Copilot,5,4,1,80.0,6,3,3,50.0,1,0,1,0.0
250874,Pin recent command throwing,Tyriar,closed,2025-06-06T16:59:10Z,2025-06-06T17:44:44Z,3125342174,True,None,3,2,1,66.67,0,0,0,0.0,2,0,2,0.0
841,Tdarr_Plugin_078d_Output_embedded_subs_to_SRT_and_remove does not see or touch MPEG-4 Timed Text (MP4TT / tx3g) subs,taltamir,open,2025-06-06T02:34:36Z,,3125399341,True,Copilot,5,4,1,80.0,4,2,2,50.0,0,0,0,0.0
1903,chore: add copilot instructions,evan-forbes,closed,2025-06-03T09:16:44Z,2025-06-03T18:34:55Z,3125458401,True,"github-advanced-security[bot], Copilot, azure-pipelines[bot]",20,9,11,45.0,19,9,10,47.37,8,5,3,62.5
241993,Multi-command support for terminal suggest,mjbvz,closed,2025-02-26T00:14:48Z,2025-06-10T19:18:46Z,3125459043,True,"Copilot, copilot-swe-agent[bot]",19,15,4,78.95,24,11,13,45.83,4,2,2,50.0
2222,Lock piles from being viewed without owner consent,brine,open,2023-07-31T23:49:39Z,,3125485068,True,Copilot,6,6,0,100.0,5,2,3,40.0,1,0,1,0.0
33710,[ServiceBus/EventHubs] add samples using threading/locks,swathipil,closed,2024-01-04T22:09:37Z,2025-06-10T16:13:46Z,3125522194,True,None,3,3,0,100.0,0,0,0,0.0,0,0,0,0.0
33710,[ServiceBus/EventHubs] add samples using threading/locks,swathipil,closed,2024-01-04T22:09:37Z,2025-06-10T16:13:46Z,3125531606,True,"Copilot, azure-pipelines[bot], copilot-swe-agent[bot]",10,8,2,80.0,8,5,3,62.5,28,18,10,64.29
16,Stop pushing commits as me,aavetis,closed,2025-06-06T18:36:47Z,2025-06-06T18:45:32Z,3125567918,True,None,2,2,0,100.0,0,0,0,0.0,0,0,0,0.0
5794,Update usage of Ubuntu 20.04 buildtools containers,mthalman,closed,2025-06-06T15:20:16Z,2025-06-06T21:41:35Z,3125572038,True,None,2,2,0,100.0,0,0,0,0.0,0,0,0,0.0
248559,Resource completions use wrong path separator for git bash,meganrogge,closed,2025-05-09T20:54:09Z,2025-06-10T19:17:48Z,3125573230,True,None,3,3,0,100.0,0,0,0,0.0,0,0,0,0.0
1106,Refactoring btl_cmd for Decoupling and Testability,Albeoris,open,2025-05-31T17:18:00Z,,3105811678,True,Copilot,1,1,0,100.0,1,1,0,100.0,0,0,0,0.0
1106,Refactoring btl_cmd for Decoupling and Testability,Albeoris,open,2025-05-31T17:18:00Z,,3105820644,True,Copilot,1,1,0,100.0,1,1,0,100.0,0,0,0,0.0
4480,(CI/CD): CodeQL did not detect Java/Kotlin code being built,avifenesh,closed,2025-07-26T07:27:43Z,2025-07-28T07:46:16Z,3265287758,True,None,2,2,0,100.0,0,0,0,0.0,2,0,2,0.0
2114,Auto create master docker contaienr,commjoen,closed,2025-07-25T07:43:35Z,2025-07-26T09:19:13Z,3265319179,True,Copilot,3,3,0,100.0,5,2,3,40.0,2,0,2,0.0
538,improve solver resolution and config precedence,0xkarmacoma,closed,2025-06-11T22:19:35Z,2025-06-14T00:51:02Z,3265325720,True,"copilot-pull-request-reviewer[bot], codspeed-hq[bot], Copilot, copilot-swe-agent[bot]",6,6,0,100.0,5,5,0,100.0,10,5,5,50.0
10265,AssemblyStore documentation needs to be updated,grendello,closed,2025-07-02T09:36:26Z,2025-07-02T14:48:45Z,3195268003,True,copilot-swe-agent[bot],4,3,1,75.0,0,0,0,0.0,2,1,1,50.0
1698,Meta Collection Dashboard button should be more prominent/always visible,cd-rite,closed,2025-07-16T14:53:08Z,2025-07-21T17:10:00Z,3195300873,True,Copilot,5,5,0,100.0,4,2,2,50.0,0,0,0,0.0
1740,Document behavior for negative and missing savings values in cost calculations,arthurclares,closed,2025-07-02T09:58:53Z,2025-07-17T17:44:52Z,3195329595,True,copilot-swe-agent[bot],13,3,10,23.08,0,0,0,0.0,14,5,9,35.71
21384,[Blazor] Throw meaningful exception for JSRuntime calls that timeout,captainsafia,open,2020-04-30T22:20:19Z,,3195365909,True,"Copilot, copilot-swe-agent[bot]",4,4,0,100.0,4,1,3,25.0,6,2,4,33.33
66,Identify any missing pages at https://spotifyscraper.readthedocs.io,AliAkhtari78,closed,2025-06-01T07:27:35Z,2025-06-01T09:34:42Z,3106782733,True,"github-actions[bot], codecov-commenter, Copilot",4,4,0,100.0,6,4,2,66.67,0,0,0,0.0
9614,Managing secrets with AzureKeyVaultResource,davidfowl,closed,2025-06-01T07:56:52Z,2025-06-03T02:23:45Z,3106934710,True,"Copilot, copilot-swe-agent[bot]",23,17,6,73.91,22,13,9,59.09,24,10,14,41.67
189,Release 2.3.0 for win-x64 does not respect InitClientEncryption configuration,mazuschlag,closed,2025-05-28T20:32:47Z,2025-06-02T12:08:58Z,3107193301,True,None,3,3,0,100.0,3,0,3,0.0,1,0,1,0.0
5278,Add tests for Assert.DoesNotContain,Youssef1313,closed,2025-03-20T11:47:55Z,2025-07-15T12:22:51Z,3231624510,True,None,3,3,0,100.0,0,0,0,0.0,3,0,3,0.0
3487,Allow custom --help output,MarcoRossignoli,closed,2024-08-07T06:59:07Z,2025-07-16T10:03:31Z,3231648781,True,copilot-swe-agent[bot],9,5,4,55.56,0,0,0,0.0,6,4,2,66.67
1259,Extend naming pattern flexibility,bt-justtrack,open,2025-07-10T09:59:21Z,,3231652557,True,"Copilot, copilot-swe-agent[bot]",14,13,1,92.86,7,4,3,57.14,30,24,6,80.0
254976,tabSize - Value must be less than or equal to 16. - Please disable this limitation.,dawidd4,closed,2025-07-09T21:04:16Z,2025-07-17T13:21:43Z,3231681142,True,Copilot,3,3,0,100.0,4,2,2,50.0,5,0,5,0.0
450,Translate the first half of howto/descriptor,josix,open,2023-07-08T06:28:45Z,,3231716362,True,Copilot,6,6,0,100.0,2,1,1,50.0,0,0,0,0.0
35371,Disable Optimize in no-db mode,abremard,closed,2025-07-15T10:27:19Z,2025-07-24T01:28:06Z,3231720206,True,"Copilot, copilot-swe-agent[bot]",7,0,7,0.0,4,3,1,75.0,18,7,11,38.89
34385,Return Error on APIs Requiring Secondary Storage,abremard,closed,2025-06-26T08:26:24Z,2025-07-24T03:32:35Z,3231788654,True,"Copilot, copilot-swe-agent[bot]",14,0,14,0.0,5,2,3,40.0,19,3,16,15.79
2510,Better health check for light client prover,ercecan,open,2025-07-01T11:31:18Z,,3121678248,True,"Copilot, copilot-swe-agent[bot]",1,0,1,0.0,5,2,3,40.0,24,4,20,16.67
996,DENON HOME 150: Report to developer as GitHub issue with details for device,foxriver76,closed,2022-12-06T13:03:15Z,2025-07-26T16:22:54Z,3263149922,True,Copilot,7,6,1,85.71,4,2,2,50.0,0,0,0,0.0
1069,Unknown Device - Firetv Omni ,Hant0r,closed,2023-09-19T20:50:32Z,2025-07-26T16:17:02Z,3263150786,True,None,4,3,1,75.0,0,0,0,0.0,1,0,1,0.0
1070,Unknown device: Echo Link,fennsen64,closed,2023-09-23T10:30:25Z,2025-07-26T16:19:55Z,3263151137,True,None,5,4,1,80.0,0,0,0,0.0,1,0,1,0.0
1079,Unknown new Device - Amazon Fire TV-4-Serie Smart-TV,BernhardLinz,closed,2023-10-15T05:37:42Z,2025-07-26T16:17:57Z,3263151537,True,None,4,3,1,75.0,0,0,0,0.0,1,0,1,0.0
1081,"Unknown Device, but enabling commands Fire TV Cube",chris76e,closed,2023-10-15T05:56:16Z,2025-07-26T16:20:31Z,3263151814,True,Copilot,5,4,1,80.0,2,1,1,50.0,0,0,0,0.0
1082,Report to developer as GitHub issue with details for device.,MischaI,closed,2023-10-17T19:30:57Z,2025-07-26T16:37:32Z,3263152067,True,Copilot,5,5,0,100.0,4,2,2,50.0,0,0,0,0.0
1089,Philips TAB8805/10 3.1 Soundbar (Connected Play-Fi-5),Mayflower7482,closed,2023-10-29T11:34:01Z,2025-07-26T16:21:01Z,3263152577,True,Copilot,4,4,0,100.0,2,1,1,50.0,0,0,0,0.0
1113,Unknown device Samsung Soundbar Q930B,martinschm,closed,2023-12-02T05:52:04Z,2025-07-26T16:29:17Z,3263153297,True,Copilot,5,4,1,80.0,2,1,1,50.0,0,0,0,0.0
1231,Report to developer as GitHub issue with details for device...  A2TX61L00VISA5 - FireHDX,MarcelMo,closed,2025-07-21T18:59:39Z,2025-07-26T16:19:18Z,3263154781,True,Copilot,5,4,1,80.0,2,1,1,50.0,0,0,0,0.0
1175,"*runtime.TypeAssertionError: interface conversion: interface {} is []interface {}, not map[interface {}]interface {}",sentry-io[bot],closed,2025-07-25T13:03:51Z,2025-08-03T20:02:12Z,3263180193,True,None,2,2,0,100.0,0,0,0,0.0,0,0,0,0.0
6812,Migrate 'entra administrativeunit remove' to Zod,martinlingstuyl,open,2025-07-25T13:15:09Z,,3263203091,True,"Copilot, copilot-swe-agent[bot]",3,3,0,100.0,4,2,2,50.0,2,1,1,50.0
1231,Report to developer as GitHub issue with details for device...  A2TX61L00VISA5 - FireHDX,MarcelMo,closed,2025-07-21T18:59:39Z,2025-07-26T16:19:18Z,3263238496,True,Copilot,7,4,3,57.14,1,1,0,100.0,3,0,3,0.0
246,Useless duplicate GitHub release drafts get created sometimes,sgb-io,closed,2025-07-25T09:13:28Z,2025-07-25T14:34:21Z,3263262091,True,Copilot,2,2,0,100.0,2,1,1,50.0,1,0,1,0.0
36791,[docs] Client certificates add note about rejecting all the certificates,mxschmitt,closed,2025-07-25T13:45:51Z,2025-07-28T13:26:22Z,3263294734,True,"github-actions[bot], Copilot, copilot-swe-agent[bot]",5,4,1,80.0,3,2,1,66.67,3,1,2,33.33
61642,Invalid quick fix for function returning `Promise<unknown>` with `isolatedDeclarations` ,bradzacher,closed,2025-05-02T04:40:05Z,2025-06-12T23:19:40Z,3141369441,True,Copilot,2,2,0,100.0,3,1,2,33.33,0,0,0,0.0
1690,[DevOps] Create a test to check for broken links,flanakin,open,2025-06-12T19:23:49Z,,3141381557,True,"copilot-pull-request-reviewer[bot], github-advanced-security[bot], copilot-swe-agent[bot]",3,3,0,100.0,0,0,0,0.0,5,4,1,80.0
19545,"[Feature Request]: Select variable name including ""@"" prefix when double-clicked",MartinVycital,open,2025-06-07T22:21:22Z,,3141435438,True,None,3,3,0,100.0,0,0,0,0.0,0,0,0,0.0
35249,Test SDK agent workflow,praveenkuttappan,open,2025-06-12T20:06:49Z,,3141437950,True,openapi-pipeline-app[bot],1,1,0,100.0,2,2,0,100.0,0,0,0,0.0
1358,Customize the development environment for Copilot Coding Agent,dylan-smith,closed,2025-06-12T20:23:18Z,2025-06-20T14:23:01Z,3141472779,True,"Copilot, copilot-swe-agent[bot]",6,6,0,100.0,2,1,1,50.0,9,4,5,44.44
2981,getChildren: Eliminate duplication in sort logic,raineorshine,closed,2025-05-31T09:54:58Z,2025-06-13T10:11:09Z,3141571114,True,copilot-swe-agent[bot],4,4,0,100.0,0,0,0,0.0,7,4,3,57.14
2525,Language service should use Unrestricted as the default target profile for notebooks,minestarks,closed,2025-06-12T22:02:21Z,2025-06-16T20:47:17Z,3141665913,True,"Copilot, copilot-swe-agent[bot]",7,5,2,71.43,3,2,1,66.67,4,2,2,50.0
1358,Customize the development environment for Copilot Coding Agent,dylan-smith,closed,2025-06-12T20:23:18Z,2025-06-20T14:23:01Z,3141778993,True,codecov-commenter,2,2,0,100.0,1,1,0,100.0,0,0,0,0.0
11113,Support cross-tenant triggers (Update Microsoft.Extensions.Azure to 1.12.0),mattchenderson,closed,2025-06-11T17:44:37Z,2025-07-24T22:46:27Z,3141802223,True,"Copilot, azure-pipelines[bot]",9,5,4,55.56,23,10,13,43.48,5,0,5,0.0
2314,Simplify using data classes for concepts and operations,KuechA,open,2025-05-23T19:10:56Z,,3209861533,True,copilot-swe-agent[bot],6,6,0,100.0,1,0,1,0.0,8,5,3,62.5
24287,`nint` and `nuint` types Constants specifies range for 32-bit process,gfoidl,closed,2021-05-19T10:02:27Z,2025-07-08T16:13:42Z,3209872688,True,None,2,2,0,100.0,0,0,0,0.0,2,0,2,0.0
1647,petri: don't create vms with super long names,mattkur,open,2025-07-03T05:44:00Z,,3209908129,True,"github-actions[bot], Copilot, copilot-swe-agent[bot]",6,6,0,100.0,23,9,14,39.13,11,4,7,36.36
3058,inconsistency with `Clone` implementations for `SdkLogger` / `SdkTracer`,davidhewitt,closed,2025-07-07T10:32:00Z,2025-07-16T17:07:45Z,3209926289,True,"linux-foundation-easycla[bot], copilot-swe-agent[bot], Copilot, codecov[bot]",2,0,2,0.0,5,3,2,60.0,3,1,2,33.33
24369,Why CS0236,AmethS,closed,2021-05-25T06:38:37Z,2025-07-15T16:18:57Z,3209929940,True,"Copilot, copilot-swe-agent[bot]",4,4,0,100.0,7,2,5,28.57,7,3,4,42.86
23501,Create tests for valid declarations: Some tests the writeup says should fail do not fail,KevinSWork,closed,2021-03-26T12:52:32Z,2025-07-08T16:14:13Z,3209933068,True,copilot-swe-agent[bot],3,3,0,100.0,0,0,0,0.0,4,1,3,25.0
253569,The terminal fails to identify the correct path name with a space character in PowerShell,Timothy-Liuxf,closed,2025-07-02T06:57:36Z,2025-07-09T16:50:20Z,3209954297,True,"Copilot, copilot-swe-agent[bot]",8,6,2,75.0,6,4,2,66.67,11,4,7,36.36
61960,NumberFormatPartTypeRegistry doesn't have approximatelySign in it,SalOne22,open,2025-06-27T19:22:37Z,,3209986350,True,None,3,3,0,100.0,0,0,0,0.0,1,0,1,0.0
52,Incompatible with React 19,jmielbrecht-symetrix,closed,2025-01-24T17:20:36Z,2025-06-24T18:57:29Z,3209991607,True,"copilot-pull-request-reviewer[bot], Copilot, copilot-swe-agent[bot]",9,8,1,88.89,12,5,7,41.67,6,5,1,83.33
382,Small improvement: use an empty array to indicate successful but empty result,JasonYeMSFT,open,2025-06-17T17:25:44Z,,3210012567,True,"github-actions[bot], Copilot, copilot-swe-agent[bot]",3,3,0,100.0,3,2,1,66.67,5,1,4,20.0
6212,Update Avatar test files from Jest to Vitest,joshblack,closed,2025-06-17T14:42:46Z,2025-07-15T16:56:40Z,3210037675,True,"github-actions[bot], changeset-bot[bot], copilot-swe-agent[bot]",7,4,3,57.14,4,4,0,100.0,4,1,3,25.0
984,[FEATURE] CLI: Support `devEngines`,darcyclarke,open,2025-07-07T19:30:54Z,,3210046280,True,vercel[bot],2,2,0,100.0,1,1,0,100.0,0,0,0,0.0
625,Implement tests for generated packet structures,sven-n,closed,2025-07-07T19:35:03Z,2025-07-08T04:51:43Z,3210054056,True,"gemini-code-assist[bot], Copilot, copilot-swe-agent[bot]",8,8,0,100.0,6,4,2,66.67,17,12,5,70.59
153,功能请求：调用自定义函数/工具时可设置计费,GeorgeXie2333,closed,2025-07-11T03:12:09Z,2025-07-11T06:27:49Z,3210070911,True,None,3,3,0,100.0,0,0,0,0.0,0,0,0,0.0
644,Cannot deserialize ResourceLinkBlock,KrakerXyz,closed,2025-07-23T12:13:26Z,2025-07-23T16:52:47Z,3256236380,True,copilot-swe-agent[bot],7,7,0,100.0,0,0,0,0.0,8,3,5,37.5
